{
  "schema_version": 1,
  "kind": "photon_report",
  "node": "MossPhotonSampler",
  "pack": {
    "name": "ComfyUI-MossPhoton",
    "version": "0.2.0"
  },
  "env": {
    "comfyui_version": "0.42.0",
    "comfyui_commit": null,
    "python": "3.13",
    "torch": "2.9.0+cu130",
    "cuda": "13.0",
    "device": "cuda:0",
    "device_name": "NVIDIA GeForce RTX 5090",
    "attention": {
      "global": "pytorch",
      "model_override": null
    },
    "deterministic_flag": false,
    "weights_streaming": false,
    "inference_dtype": "torch.bfloat16"
  },
  "label": {
    "preset_status": "stable",
    "ui_label": "stable",
    "parity_class": "reference_exact",
    "not_reference_reasons": [],
    "modifiers": [],
    "calibrated": false,
    "customized": false,
    "recommended_final": true
  },
  "preset": {
    "id": "reference",
    "version": "1.0.0",
    "sha256": "0000000000000000000000000000000000000000000000000000000000000000",
    "pin": "reference@1.0.0#00000000",
    "pinned": true,
    "manifest_sha256": null,
    "layers_applied": [
      "preset"
    ],
    "diff": []
  },
  "model": {
    "architecture": "moss_image",
    "family": "moss-image-sft",
    "num_layers": 42,
    "identity": {
      "sha256": "f96738d8116d78b7316b57c663d8c98591ddafab7488f48e3099b7655e34ab6f",
      "size": 10164655808,
      "basename": "moss_image_sft_bf16.safetensors",
      "hash_source": "cache",
      "classified_by": "known_table",
      "official": true,
      "variant": "bf16",
      "verified_matrix": true
    },
    "model_sampling": {
      "class": "ModelSamplingDiscreteFlow+CONST",
      "shift": 5.0,
      "multiplier": 1.0
    }
  },
  "text_encoder": null,
  "conditioning": {
    "positive": {
      "entries": 1,
      "tokens": [
        23
      ],
      "dim": 4096,
      "sha256": "0000000000000000000000000000000000000000000000000000000000000000"
    },
    "negative": {
      "entries": 1,
      "tokens": [
        9
      ],
      "dim": 4096,
      "sha256": "0000000000000000000000000000000000000000000000000000000000000000"
    }
  },
  "inputs": {
    "seed": 42,
    "batch": 1,
    "width": 1024,
    "height": 1024,
    "latent_shape": [
      1,
      128,
      64,
      64
    ],
    "latent_dtype": "torch.float32",
    "latent_was_empty": true,
    "latent_raw_shape": [
      1,
      128,
      64,
      64
    ],
    "latent_rescaled_by_native_fix": false,
    "noise_policy": "native",
    "subseeds": [
      42
    ],
    "noise_sha256": "0000000000000000000000000000000000000000000000000000000000000000"
  },
  "sampling": {
    "steps": 50,
    "sampler": "euler",
    "scheduler": "sgm_uniform",
    "shift": 5.0,
    "cfg": 3.0,
    "slg": {
      "mode": "uncond_skip",
      "layers": [
        22
      ],
      "start": 0.0,
      "end": 1.0,
      "sigma_window": [
        0.0,
        1.0
      ]
    },
    "restart": false,
    "ancestral_noise": false,
    "sigmas": {
      "source": "native_scheduler",
      "n": 51,
      "sha256": "9b2c66b3fb335d998fc03e73ddbafe997fe2d3cf3b187f51629bdf0332f5a536",
      "first": 1.0,
      "last": 0.0,
      "equals_native": true
    }
  },
  "lora": {
    "stack": [],
    "foreign_patches": {
      "entries_expected": 0,
      "entries_observed": 0,
      "baseline_entries": 0,
      "uuid_match": true,
      "extra_entries": 0,
      "keys_sample": []
    },
    "te_applied": false,
    "profile_digest": null
  },
  "guards": {
    "finite_check": "passed",
    "items": [],
    "composition_limit": {
      "enabled": false
    },
    "guard_passed": false
  },
  "forwards": {
    "expected_branch_forwards": 100,
    "expected_sample_forwards": 100,
    "model_calls": 100,
    "sample_forwards": 100,
    "slg_skip_calls": 50,
    "extra": 0,
    "match": true
  },
  "timing": {
    "total_s": 96.4,
    "preflight_s": 1.2,
    "sampling_s": 94.8,
    "step_s_mean": 1.9,
    "step_s_max": 2.1,
    "estimate_s": null
  },
  "memory": {
    "measured": true,
    "peak_vram_bytes": 0,
    "device": "cuda:0"
  },
  "preview": {
    "enabled": true
  },
  "output": {
    "latent_shape": [
      1,
      128,
      64,
      64
    ],
    "latent_sha256": "0000000000000000000000000000000000000000000000000000000000000000",
    "finite": true
  },
  "warnings": [
    {
      "code": "family_not_verified",
      "severity": "info",
      "node": "MossPhotonSampler",
      "param": "model",
      "message": "illustrative only",
      "fix": "n/a"
    }
  ],
  "fallbacks": [],
  "privacy": {
    "prompts_logged": false,
    "reference_photos_logged": false
  },
  "recipe_hash": "0000000000000000000000000000000000000000000000000000000000000000",
  "created_utc": "2026-10-25T12:00:00Z"
}
